{
  "$schema": "../schema/contract.schema.json",
  "domain": "state",
  "title": "States (UF)",
  "description": "Brazilian states (unidades federativas): codes, names, IBGE codes and time zones.",
  "functions": {
    "getByIbgeCode": {
      "summary": "Retrieves the Brazilian state whose 2-digit IBGE code (\"cUF\", the Código da Unidade da Federação) matches the given value.",
      "description": [
        "Returns the state whose 2-digit IBGE code (cUF, the code in the first field of a DF-e access key) matches `code`.",
        "",
        "- `code` may be a string or a non-negative integer.",
        "- The result has the code, name, region code, region name and IBGE code.",
        "- Returns null when the code matches no state."
      ],
      "references": [
        "https://servicodados.ibge.gov.br/api/v1/localidades/estados",
        "https://www.confaz.fazenda.gov.br/legislacao/arquivo-manuais/moc7-visao-geral.pdf"
      ],
      "flatName": "getStateByIbgeCode",
      "params": [{ "name": "code", "type": "string | number" }],
      "returns": "State?",
      "tests": [
        { "name": "sao-paulo", "args": ["35"], "returns": { "code": "SP", "name": "São Paulo", "regionCode": "SE", "regionName": "Sudeste", "ibgeCode": 35 } },
        { "name": "number", "args": [35], "returns": { "code": "SP", "name": "São Paulo", "regionCode": "SE", "regionName": "Sudeste", "ibgeCode": 35 } },
        { "name": "distrito-federal", "args": ["53"], "returns": { "code": "DF", "name": "Distrito Federal", "regionCode": "CO", "regionName": "Centro-Oeste", "ibgeCode": 53 } },
        { "args": ["00"], "returns": null },
        { "args": ["99"], "returns": null },
        { "name": "empty", "args": [""], "returns": null }
      ]
    },
    "getCodeByName": {
      "summary": "Retrieves the two-letter code (sigla) of a Brazilian state given its full name.",
      "description": [
        "Returns the two-letter code (sigla) of a state from its full name.",
        "",
        "- The match ignores accents, case and surrounding whitespace; internal whitespace collapses into one space.",
        "- Returns null when no state matches."
      ],
      "references": ["https://servicodados.ibge.gov.br/api/v1/localidades/estados"],
      "flatName": "getStateCodeByName",
      "params": [{ "name": "name", "type": "string" }],
      "returns": "string?",
      "tests": [
        { "args": ["São Paulo"], "returns": "SP" },
        { "name": "without-accents", "args": ["Sao Paulo"], "returns": "SP" },
        { "name": "lowercase", "args": ["sao paulo"], "returns": "SP" },
        { "name": "padded", "args": ["  São Paulo  "], "returns": "SP" },
        { "args": ["Rio Grande do Norte"], "returns": "RN" },
        { "args": ["Distrito Federal"], "returns": "DF" },
        { "args": ["Neverland"], "returns": null },
        { "name": "empty", "args": [""], "returns": null }
      ]
    },
    "getNameByCode": {
      "summary": "Retrieves the full name of a Brazilian state given its two-letter code (sigla).",
      "description": [
        "Returns the full name of a state from its two-letter code (sigla).",
        "",
        "- The match ignores case and surrounding whitespace.",
        "- Returns null when no state matches."
      ],
      "references": ["https://servicodados.ibge.gov.br/api/v1/localidades/estados"],
      "flatName": "getStateNameByCode",
      "params": [{ "name": "code", "type": "string" }],
      "returns": "string?",
      "tests": [
        { "args": ["SP"], "returns": "São Paulo" },
        { "name": "lowercase", "args": ["sp"], "returns": "São Paulo" },
        { "name": "padded", "args": ["  RJ  "], "returns": "Rio de Janeiro" },
        { "args": ["DF"], "returns": "Distrito Federal" },
        { "args": ["ZZ"], "returns": null },
        { "name": "empty", "args": [""], "returns": null }
      ]
    },
    "getTimezone": {
      "summary": "Retrieves the IANA time zone database name (tzdata zone) for a Brazilian state, chosen as the zone of the state capital. The match is case-insensitive and ignores leading/trailing whitespace.",
      "description": [
        "Returns the IANA time zone (tzdata zone) of a state: the zone of its capital, e.g. `America/Sao_Paulo`.",
        "",
        "- The match ignores case and surrounding whitespace.",
        "- Returns null when no state matches."
      ],
      "references": ["https://www.iana.org/time-zones"],
      "flatName": "getTimezoneByState",
      "params": [{ "name": "stateCode", "type": "string" }],
      "returns": "string?",
      "tests": [
        { "args": ["SP"], "returns": "America/Sao_Paulo" },
        { "args": ["AM"], "returns": "America/Manaus" },
        { "args": ["AC"], "returns": "America/Rio_Branco" },
        { "args": ["BA"], "returns": "America/Bahia" },
        { "name": "lowercase", "args": ["sp"], "returns": "America/Sao_Paulo" },
        { "name": "padded", "args": ["  SP  "], "returns": "America/Sao_Paulo" },
        { "args": ["ZZ"], "returns": null },
        { "name": "empty", "args": [""], "returns": null }
      ]
    },
    "list": {
      "summary": "Retrieves a list of all Brazilian states with their codes and names.",
      "description": [
        "Returns the 27 Brazilian federative units, sorted by name (pt-BR collation).",
        "",
        "- Each entry has the two-letter code, the name, the region code and name, and the 2-digit IBGE code."
      ],
      "references": ["https://servicodados.ibge.gov.br/api/docs/localidades"],
      "flatName": "getStates",
      "params": [],
      "returns": "State[]",
      "tests": [
        {
          "name": "all-states",
          "args": [],
          "returns": [
            { "code": "AC", "name": "Acre", "regionCode": "N", "regionName": "Norte", "ibgeCode": 12 },
            { "code": "AL", "name": "Alagoas", "regionCode": "NE", "regionName": "Nordeste", "ibgeCode": 27 },
            { "code": "AP", "name": "Amapá", "regionCode": "N", "regionName": "Norte", "ibgeCode": 16 },
            { "code": "AM", "name": "Amazonas", "regionCode": "N", "regionName": "Norte", "ibgeCode": 13 },
            { "code": "BA", "name": "Bahia", "regionCode": "NE", "regionName": "Nordeste", "ibgeCode": 29 },
            { "code": "CE", "name": "Ceará", "regionCode": "NE", "regionName": "Nordeste", "ibgeCode": 23 },
            {
              "code": "DF",
              "name": "Distrito Federal",
              "regionCode": "CO",
              "regionName": "Centro-Oeste",
              "ibgeCode": 53
            },
            { "code": "ES", "name": "Espírito Santo", "regionCode": "SE", "regionName": "Sudeste", "ibgeCode": 32 },
            { "code": "GO", "name": "Goiás", "regionCode": "CO", "regionName": "Centro-Oeste", "ibgeCode": 52 },
            { "code": "MA", "name": "Maranhão", "regionCode": "NE", "regionName": "Nordeste", "ibgeCode": 21 },
            { "code": "MT", "name": "Mato Grosso", "regionCode": "CO", "regionName": "Centro-Oeste", "ibgeCode": 51 },
            {
              "code": "MS",
              "name": "Mato Grosso do Sul",
              "regionCode": "CO",
              "regionName": "Centro-Oeste",
              "ibgeCode": 50
            },
            { "code": "MG", "name": "Minas Gerais", "regionCode": "SE", "regionName": "Sudeste", "ibgeCode": 31 },
            { "code": "PA", "name": "Pará", "regionCode": "N", "regionName": "Norte", "ibgeCode": 15 },
            { "code": "PB", "name": "Paraíba", "regionCode": "NE", "regionName": "Nordeste", "ibgeCode": 25 },
            { "code": "PR", "name": "Paraná", "regionCode": "S", "regionName": "Sul", "ibgeCode": 41 },
            { "code": "PE", "name": "Pernambuco", "regionCode": "NE", "regionName": "Nordeste", "ibgeCode": 26 },
            { "code": "PI", "name": "Piauí", "regionCode": "NE", "regionName": "Nordeste", "ibgeCode": 22 },
            { "code": "RJ", "name": "Rio de Janeiro", "regionCode": "SE", "regionName": "Sudeste", "ibgeCode": 33 },
            {
              "code": "RN",
              "name": "Rio Grande do Norte",
              "regionCode": "NE",
              "regionName": "Nordeste",
              "ibgeCode": 24
            },
            { "code": "RS", "name": "Rio Grande do Sul", "regionCode": "S", "regionName": "Sul", "ibgeCode": 43 },
            { "code": "RO", "name": "Rondônia", "regionCode": "N", "regionName": "Norte", "ibgeCode": 11 },
            { "code": "RR", "name": "Roraima", "regionCode": "N", "regionName": "Norte", "ibgeCode": 14 },
            { "code": "SC", "name": "Santa Catarina", "regionCode": "S", "regionName": "Sul", "ibgeCode": 42 },
            { "code": "SP", "name": "São Paulo", "regionCode": "SE", "regionName": "Sudeste", "ibgeCode": 35 },
            { "code": "SE", "name": "Sergipe", "regionCode": "NE", "regionName": "Nordeste", "ibgeCode": 28 },
            { "code": "TO", "name": "Tocantins", "regionCode": "N", "regionName": "Norte", "ibgeCode": 17 }
          ],
          "note": "27 federative units sorted by name, as held by the reference"
        }
      ]
    }
  }
}
