{
  "$schema": "../schema/contract.schema.json",
  "domain": "areaCode",
  "title": "DDD — Brazilian area codes",
  "description": "Telephone area codes (DDD) in use under the Anatel Plano Geral de Numeração, and the states they serve.",
  "functions": {
    "getInfo": {
      "summary": "Retrieves the state (and its region) a Brazilian DDD (area code) belongs to.",
      "description": [
        "Returns the state and region a DDD (area code) belongs to, among the 67 DDDs in use under the Anatel Plano Geral de Numeração.",
        "",
        "- `areaCode` may be a string or a non-negative integer.",
        "- The result carries the DDD, the state it is seated in (code and name), its region (code and name) and every state it serves.",
        "- For the four DDDs that straddle a state border (61, 42, 47 and 49) the list of states also has the other state, the seat first.",
        "- Returns null for a DDD not in use, a negative or non-integer number, or anything else."
      ],
      "references": [
        "https://informacoes.anatel.gov.br/legislacao/resolucoes/2022/1641-resolucao-749",
        "https://www.gov.br/anatel/pt-br/regulado/numeracao/codigos-nacionais"
      ],
      "flatName": "getAreaCodeInfo",
      "params": [{ "name": "areaCode", "type": "string | number" }],
      "returns": "AreaCodeInfo?",
      "tests": [
        { "args": ["11"], "returns": { "areaCode": 11, "stateCode": "SP", "stateName": "São Paulo", "regionCode": "SE", "regionName": "Sudeste", "stateCodes": ["SP"] } },
        { "name": "number", "args": [11], "returns": { "areaCode": 11, "stateCode": "SP", "stateName": "São Paulo", "regionCode": "SE", "regionName": "Sudeste", "stateCodes": ["SP"] } },
        { "name": "distrito-federal", "args": ["61"], "returns": { "areaCode": 61, "stateCode": "DF", "stateName": "Distrito Federal", "regionCode": "CO", "regionName": "Centro-Oeste", "stateCodes": ["DF", "GO"] } },
        { "name": "multi-state", "args": [42], "returns": { "areaCode": 42, "stateCode": "PR", "stateName": "Paraná", "regionCode": "S", "regionName": "Sul", "stateCodes": ["PR", "SC"] } },
        { "args": ["00"], "returns": null },
        { "name": "unassigned", "args": ["20"], "returns": null },
        { "name": "empty", "args": [""], "returns": null }
      ]
    },
    "listByState": {
      "summary": "Retrieves every DDD (area code) that serves a given Brazilian state, under the Plano Geral de Numeração.",
      "description": [
        "Returns every DDD (area code) that serves a state, sorted in ascending order.",
        "",
        "- `stateCode` is matched case-insensitively.",
        "- A DDD that straddles a border is listed under every state it serves.",
        "- Returns an empty list when `stateCode` is not a Brazilian state."
      ],
      "references": [
        "https://informacoes.anatel.gov.br/legislacao/resolucoes/2022/1641-resolucao-749",
        "https://www.gov.br/anatel/pt-br/regulado/numeracao/codigos-nacionais"
      ],
      "flatName": "getAreaCodesByState",
      "params": [{ "name": "stateCode", "type": "string" }],
      "returns": "number[]",
      "tests": [
        { "args": ["SP"], "returns": [11, 12, 13, 14, 15, 16, 17, 18, 19] },
        { "name": "lowercase", "args": ["sp"], "returns": [11, 12, 13, 14, 15, 16, 17, 18, 19] },
        { "args": ["AC"], "returns": [68] },
        { "args": ["PE"], "returns": [81, 87] },
        { "name": "shared-ddds", "args": ["SC"], "returns": [42, 47, 48, 49] },
        { "args": ["XX"], "returns": [] },
        { "name": "empty", "args": [""], "returns": [] }
      ]
    }
  }
}
