{
  "$schema": "../schema/contract.schema.json",
  "domain": "cnpj",
  "title": "CNPJ — Cadastro Nacional da Pessoa Jurídica",
  "description": "The Brazilian company tax id, numeric and alphanumeric.",
  "functions": {
    "format": {
      "summary": "Formats a given CNPJ (Cadastro Nacional da Pessoa Jurídica) value according to the specified options.",
      "description": [
        "Formats a CNPJ as `00.000.000/0000-00`.",
        "",
        "- `options.pad` left-pads the value with zeros to 14 characters first.",
        "- `options.version`: `1` (default) keeps digits only; `2` (alphanumeric CNPJ) keeps letters, upper-cased, and digits.",
        "- `options.obfuscate` hides the first 2 digits and the 2 check digits with `*`, after padding.",
        "- Pending decision (findings §2 #2, #3): the reference (JS) masks an incomplete value as far as it goes and returns an empty string for empty or garbage input; other libs return null."
      ],
      "references": [
        "https://www.gov.br/receitafederal/pt-br/assuntos/orientacao-tributaria/cadastros/cnpj",
        "https://www.gov.br/receitafederal/pt-br/centrais-de-conteudo/publicacoes/documentos-tecnicos/cnpj/manual-dv-cnpj.pdf",
        "https://www.gov.br/receitafederal/pt-br/acesso-a-informacao/acoes-e-programas/programas-e-atividades/cnpj-alfanumerico"
      ],
      "level": "core",
      "params": [
        { "name": "value", "type": "string | number" },
        { "name": "options", "type": "FormatCnpjOptions", "optional": true }
      ],
      "returns": "string",
      "tests": [
        { "args": ["10799163989271"], "returns": "10.799.163/9892-71", "note": "consensus of 5 libs (go, javascript, python, ruby, rust)" },
        { "args": ["64977017647333"], "returns": "64.977.017/6473-33", "note": "consensus of 5 libs (go, javascript, python, ruby, rust)" },
        { "args": ["62932200808587"], "returns": "62.932.200/8085-87", "note": "consensus of 5 libs (go, javascript, python, ruby, rust)" }
      ]
    },
    "generate": {
      "summary": "Generates a valid random CNPJ (Cadastro Nacional da Pessoa Jurídica).",
      "description": [
        "Generates a valid random CNPJ, unformatted.",
        "",
        "- `versionOrParams` picks the version, `1` (default, numeric) or `2` (alphanumeric), and optionally the branch (número de ordem), an integer from 1 to 9999 (random by default; an invalid branch is ignored).",
        "- The branch block stays numeric in both versions."
      ],
      "references": [
        "https://www.gov.br/receitafederal/pt-br/assuntos/orientacao-tributaria/cadastros/cnpj",
        "https://www.gov.br/receitafederal/pt-br/centrais-de-conteudo/publicacoes/documentos-tecnicos/cnpj/manual-dv-cnpj.pdf",
        "https://www.gov.br/receitafederal/pt-br/acesso-a-informacao/acoes-e-programas/programas-e-atividades/cnpj-alfanumerico"
      ],
      "level": "core",
      "params": [{ "name": "versionOrParams", "type": "1 | 2 | GenerateCnpjParams", "optional": true }],
      "returns": "string",
      "tests": [
        { "name": "generated-is-valid", "args": [], "satisfies": "cnpj.isValid", "repeat": 5, "note": "every generated value must pass the lib's own validator" }
      ]
    },
    "isValid": {
      "summary": "Validates if a CNPJ (Cadastro Nacional da Pessoa Jurídica) is valid. Supports both numeric (version 1) and alphanumeric (version 2) CNPJ formats. Accepts the usual mask characters (`.`, `-`, `/`) and whitespace around and between groups.",
      "description": [
        "Validates a CNPJ: 12 base characters and 2 modulus 11 check digits.",
        "",
        "- `options.version`: `1` (default) accepts numeric CNPJs only; `2` also accepts the alphanumeric CNPJ, case-insensitively. Any other value is read as `1`.",
        "- A numeric CNPJ whose digits are all the same is rejected; the alphanumeric format has no reserved list.",
        "- Pending decision (findings §2 #1): the reference (JS) ignores the mask characters (`.`, `-`, `/`) and whitespace around and between groups; other libs accept digits only."
      ],
      "references": [
        "https://www.gov.br/receitafederal/pt-br/assuntos/orientacao-tributaria/cadastros/cnpj",
        "https://www.gov.br/receitafederal/pt-br/centrais-de-conteudo/publicacoes/documentos-tecnicos/cnpj/manual-dv-cnpj.pdf",
        "https://www.gov.br/receitafederal/pt-br/acesso-a-informacao/acoes-e-programas/programas-e-atividades/cnpj-alfanumerico"
      ],
      "level": "core",
      "params": [
        { "name": "cnpj", "type": "string" },
        { "name": "options", "type": "IsValidCnpjOptions", "optional": true }
      ],
      "returns": "boolean",
      "tests": [
        { "args": ["10799163989271"], "returns": true, "note": "consensus of 5 libs (go, javascript, python, ruby, rust)" },
        { "args": ["10799163989272"], "returns": false, "note": "consensus of 5 libs (go, javascript, python, ruby, rust)" },
        { "args": ["00000000000000"], "returns": false, "note": "consensus of 5 libs (go, javascript, python, ruby, rust)" },
        { "args": ["64977017647333"], "returns": true, "note": "consensus of 5 libs (go, javascript, python, ruby, rust)" },
        { "args": ["64977017647334"], "returns": false, "note": "consensus of 5 libs (go, javascript, python, ruby, rust)" },
        { "args": ["62932200808587"], "returns": true, "note": "consensus of 5 libs (go, javascript, python, ruby, rust)" },
        { "args": ["62932200808588"], "returns": false, "note": "consensus of 5 libs (go, javascript, python, ruby, rust)" },
        { "args": [""], "returns": false, "note": "consensus of 5 libs (go, javascript, python, ruby, rust)" },
        { "args": ["   "], "returns": false, "note": "consensus of 5 libs (go, javascript, python, ruby, rust)" },
        { "args": ["abc"], "returns": false, "note": "consensus of 5 libs (go, javascript, python, ruby, rust)" }
      ]
    },
    "parse": {
      "summary": "Removes CNPJ formatting characters and returns a normalized value.",
      "description": [
        "Removes CNPJ formatting and returns the normalized value, capped to 14 characters.",
        "",
        "- `options.version`: `1` (default) keeps digits only; `2` keeps letters and digits, upper-cased."
      ],
      "references": [
        "https://www.gov.br/receitafederal/pt-br/assuntos/orientacao-tributaria/cadastros/cnpj",
        "https://www.gov.br/receitafederal/pt-br/centrais-de-conteudo/publicacoes/documentos-tecnicos/cnpj/manual-dv-cnpj.pdf",
        "https://www.gov.br/receitafederal/pt-br/acesso-a-informacao/acoes-e-programas/programas-e-atividades/cnpj-alfanumerico"
      ],
      "params": [
        { "name": "value", "type": "string | number" },
        { "name": "options", "type": "ParseCnpjOptions", "optional": true }
      ],
      "returns": "string",
      "tests": [
        { "name": "masked", "args": ["46.843.485/0001-86"], "returns": "46843485000186" },
        { "name": "unmasked", "args": ["46843485000186"], "returns": "46843485000186" },
        { "name": "strips-non-digits", "args": ["46.?ABC843.485/0001-86abc"], "returns": "46843485000186" },
        { "name": "empty", "args": [""], "returns": "" },
        { "name": "caps-length", "args": ["46843485000186123"], "returns": "46843485000186", "note": "reference truncates to the 14 characters of the document; asserted by the reference (JS) unit tests" }
      ]
    },
    "removeSymbols": {
      "summary": "Removes the formatting symbols (keeps everything else).",
      "level": "core",
      "params": [{ "name": "value", "type": "string" }],
      "returns": "string",
      "tests": [
        { "args": ["10799163989271"], "returns": "10799163989271", "note": "consensus of 3 libs (python, ruby, rust)" },
        { "args": ["10799163989272"], "returns": "10799163989272", "note": "consensus of 3 libs (python, ruby, rust)" },
        { "args": ["00000000000000"], "returns": "00000000000000", "note": "consensus of 3 libs (python, ruby, rust)" },
        { "args": ["64977017647333"], "returns": "64977017647333", "note": "consensus of 3 libs (python, ruby, rust)" },
        { "args": ["64977017647334"], "returns": "64977017647334", "note": "consensus of 3 libs (python, ruby, rust)" },
        { "args": ["62932200808587"], "returns": "62932200808587", "note": "consensus of 3 libs (python, ruby, rust)" },
        { "args": ["62932200808588"], "returns": "62932200808588", "note": "consensus of 3 libs (python, ruby, rust)" },
        { "args": ["10.799.163/9892-71"], "returns": "10799163989271", "note": "consensus of 3 libs (python, ruby, rust)" },
        { "args": ["64.977.017/6473-33"], "returns": "64977017647333", "note": "consensus of 3 libs (python, ruby, rust)" },
        { "args": ["62.932.200/8085-87"], "returns": "62932200808587", "note": "consensus of 3 libs (python, ruby, rust)" },
        { "args": [""], "returns": "", "note": "consensus of 3 libs (python, ruby, rust)" },
        { "args": ["   "], "returns": "   ", "note": "consensus of 3 libs (python, ruby, rust)" },
        { "args": ["abc"], "returns": "abc", "note": "consensus of 3 libs (python, ruby, rust)" }
      ]
    }
  }
}
