{
  "$schema": "../schema/contract.schema.json",
  "domain": "legalProcess",
  "title": "Processo jurídico — legal process number",
  "description": "Court case numbers in the unified numbering of Resolução CNJ nº 65/2008 (NUP).",
  "aliases": ["processoJuridico"],
  "functions": {
    "format": {
      "summary": "Formats a legal process number (processo jurídico) according to a specific pattern.",
      "description": [
        "Formats a legal process number with the CNJ mask `NNNNNNN-DD.AAAA.J.TR.OOOO`.",
        "",
        "- `options.pad` left-pads the value with zeros to 20 digits first.",
        "- Pending decision (findings §2 #2, #3): the reference (JS) masks an incomplete value as far as it goes and returns an empty string for empty or garbage input; other libs return null."
      ],
      "references": ["https://atos.cnj.jus.br/atos/detalhar/119"],
      "level": "core",
      "params": [
        { "name": "value", "type": "string | number" },
        { "name": "options", "type": "FormatProcessoJuridicoOptions", "optional": true }
      ],
      "returns": "string",
      "tests": [
        { "args": ["16669239820269264931"], "returns": "1666923-98.2026.9.26.4931", "note": "consensus of 5 libs (go, javascript, python, ruby, rust)" },
        { "args": ["16669239820269264932"], "returns": "1666923-98.2026.9.26.4932", "note": "consensus of 5 libs (go, javascript, python, ruby, rust)" },
        { "args": ["00000000000000000000"], "returns": "0000000-00.0000.0.00.0000", "note": "consensus of 5 libs (go, javascript, python, ruby, rust)" },
        { "args": ["55079546820269134836"], "returns": "5507954-68.2026.9.13.4836", "note": "consensus of 5 libs (go, javascript, python, ruby, rust)" },
        { "args": ["55079546820269134837"], "returns": "5507954-68.2026.9.13.4837", "note": "consensus of 5 libs (go, javascript, python, ruby, rust)" },
        { "args": ["47097579520263005802"], "returns": "4709757-95.2026.3.00.5802", "note": "consensus of 5 libs (go, javascript, python, ruby, rust)" },
        { "args": ["47097579520263005803"], "returns": "4709757-95.2026.3.00.5803", "note": "consensus of 5 libs (go, javascript, python, ruby, rust)" }
      ]
    },
    "generate": {
      "summary": "Generates a random valid Brazilian Processo Jurídico (court case) number, following the `NNNNNNNDDAAAAJTROOOO` layout of Resolução CNJ nº 65/2008.",
      "description": [
        "Generates a random valid legal process number (20 digits, unformatted) in the layout of Resolução CNJ nº 65/2008.",
        "",
        "- `options.year` sets the `AAAA` field, from the current year to 9999 (default: the current year); `options.court` sets the segment `J`, 1 to 9 (default: random).",
        "- `TR` is drawn among the tribunals of the chosen segment, so the pair always names a court that exists.",
        "- Returns null when the year or the segment is out of range."
      ],
      "references": ["https://atos.cnj.jus.br/atos/detalhar/119"],
      "level": "core",
      "params": [{ "name": "options", "type": "GenerateProcessoJuridicoParams", "optional": true }],
      "returns": "string?",
      "tests": [
        { "name": "generated-is-valid", "args": [], "satisfies": "legalProcess.isValid", "repeat": 5, "note": "every generated value must pass the lib's own validator" }
      ]
    },
    "isValid": {
      "summary": "Validates a Brazilian Processo Jurídico (court case) number.",
      "description": [
        "Validates a legal process number (Resolução CNJ nº 65/2008): the `NNNNNNN-DD.AAAA.J.TR.OOOO` layout, the `DD` check digits (ISO 7064 MOD 97-10) and the `J`/`TR` pair.",
        "",
        "- `J` and `TR` must name a segment and a tribunal that exist; the unidade de origem `OOOO` is only checked as four digits.",
        "- Accepts the 20 digits bare or with the CNJ mask; letters make it invalid.",
        "- Pending decision (findings §2 #7): numbers generated by the reference (JS) for the current year are rejected by Go, Python, Ruby and Rust; the segment/tribunal rules need to be reconciled."
      ],
      "references": ["https://atos.cnj.jus.br/atos/detalhar/119"],
      "level": "core",
      "params": [{ "name": "value", "type": "string" }],
      "returns": "boolean",
      "tests": [
        { "args": ["16669239820269264932"], "returns": false, "note": "consensus of 5 libs (go, javascript, python, ruby, rust)" },
        { "args": ["00000000000000000000"], "returns": false, "note": "consensus of 5 libs (go, javascript, python, ruby, rust)" },
        { "args": ["55079546820269134837"], "returns": false, "note": "consensus of 5 libs (go, javascript, python, ruby, rust)" },
        { "args": ["47097579520263005803"], "returns": false, "note": "consensus of 5 libs (go, javascript, python, ruby, rust)" },
        { "args": [""], "returns": false, "note": "consensus of 5 libs (go, javascript, python, ruby, rust)" },
        { "args": ["   "], "returns": false, "note": "consensus of 5 libs (go, javascript, python, ruby, rust)" },
        { "args": ["abc"], "returns": false, "note": "consensus of 5 libs (go, javascript, python, ruby, rust)" }
      ]
    },
    "parse": {
      "summary": "Removes legal process formatting characters and returns only digits.",
      "description": ["Removes legal process formatting and keeps only digits, capped to 20 digits."],
      "references": ["https://atos.cnj.jus.br/atos/detalhar/119"],
      "params": [{ "name": "value", "type": "string | number" }],
      "returns": "string",
      "tests": [
        { "name": "masked", "args": ["0002080-25.2012.5.15.0049"], "returns": "00020802520125150049" },
        { "name": "unmasked", "args": ["00020802520125150049"], "returns": "00020802520125150049" },
        { "name": "strips-non-digits", "args": ["0002080@$25201%!@2515.%0049"], "returns": "00020802520125150049" },
        { "name": "empty", "args": [""], "returns": "" },
        { "name": "caps-length", "args": ["00020802520125150049123"], "returns": "00020802520125150049", "note": "reference truncates to the 20 characters of the document; asserted by the reference (JS) unit tests" }
      ]
    },
    "removeSymbols": {
      "summary": "Removes the formatting symbols (keeps everything else).",
      "level": "core",
      "params": [{ "name": "value", "type": "string" }],
      "returns": "string",
      "tests": [
        { "args": ["16669239820269264931"], "returns": "16669239820269264931", "note": "consensus of 3 libs (python, ruby, rust)" },
        { "args": ["16669239820269264932"], "returns": "16669239820269264932", "note": "consensus of 3 libs (python, ruby, rust)" },
        { "args": ["00000000000000000000"], "returns": "00000000000000000000", "note": "consensus of 3 libs (python, ruby, rust)" },
        { "args": ["55079546820269134836"], "returns": "55079546820269134836", "note": "consensus of 3 libs (python, ruby, rust)" },
        { "args": ["55079546820269134837"], "returns": "55079546820269134837", "note": "consensus of 3 libs (python, ruby, rust)" },
        { "args": ["47097579520263005802"], "returns": "47097579520263005802", "note": "consensus of 3 libs (python, ruby, rust)" },
        { "args": ["47097579520263005803"], "returns": "47097579520263005803", "note": "consensus of 3 libs (python, ruby, rust)" },
        { "args": ["1666923-98.2026.9.26.4931"], "returns": "16669239820269264931", "note": "consensus of 3 libs (python, ruby, rust)" },
        { "args": ["5507954-68.2026.9.13.4836"], "returns": "55079546820269134836", "note": "consensus of 3 libs (python, ruby, rust)" },
        { "args": ["4709757-95.2026.3.00.5802"], "returns": "47097579520263005802", "note": "consensus of 3 libs (python, ruby, rust)" },
        { "args": [""], "returns": "", "note": "consensus of 3 libs (python, ruby, rust)" },
        { "args": ["   "], "returns": "   ", "note": "consensus of 3 libs (python, ruby, rust)" },
        { "args": ["abc"], "returns": "abc", "note": "consensus of 3 libs (python, ruby, rust)" }
      ]
    }
  }
}
