{
  "$schema": "../schema/contract.schema.json",
  "domain": "creditCard",
  "title": "Credit card",
  "description": "Payment card numbers (credit or debit), Luhn check only.",
  "functions": {
    "isValid": {
      "summary": "Validates a payment card number (crédito ou débito) using the Luhn algorithm.",
      "description": [
        "Validates a payment card number (credit or debit): 12 to 19 digits and a Luhn check digit.",
        "",
        "- No brand detection, issuer range lookup, expiry or CVV check.",
        "- A number whose digits are all the same is rejected even though it passes Luhn.",
        "- Accepts a string or a number, with whitespace, `.`, `-` and `/` anywhere between the digits; letters make it invalid. A number above the largest exactly representable integer should be passed as a string."
      ],
      "references": ["https://www.iso.org/standard/70484.html"],
      "params": [{ "name": "value", "type": "string | number" }],
      "returns": "boolean",
      "tests": [
        { "args": ["4111111111111111"], "returns": true },
        { "args": ["5555555555554444"], "returns": true },
        { "name": "15-digits", "args": ["378282246310005"], "returns": true },
        { "name": "masked", "args": ["4111 1111 1111 1111"], "returns": true },
        { "name": "luhn-fail", "args": ["4111111111111112"], "returns": false },
        { "name": "zeros", "args": ["0000000000000000"], "returns": false },
        { "name": "too-short", "args": ["60110000000"], "returns": false },
        { "name": "letters", "args": ["abcdabcdabcd"], "returns": false },
        { "name": "empty", "args": [""], "returns": false }
      ]
    }
  }
}
