{
  "$schema": "../schema/contract.schema.json",
  "domain": "bank",
  "title": "Banks — COMPE / ISPB",
  "description": "Brazilian banks from the Banco Central do Brasil STR participants list, looked up by COMPE code or ISPB.",
  "functions": {
    "getByCode": {
      "summary": "Looks up a Brazilian bank by its compensation code (COMPE), published by Banco Central do Brasil in the STR (Sistema de Transferência de Reservas) participants list.",
      "description": [
        "Looks a bank up by its 3-digit COMPE code in the Banco Central do Brasil STR participants list.",
        "",
        "- `code` may be a string or a number (a number is read as the zero-padded 3-digit code).",
        "- The result carries the COMPE `code` (3 digits), the `ispb` (8 digits) and the `name`.",
        "- Returns null when no bank has that code."
      ],
      "references": ["https://www.bcb.gov.br/content/estabilidadefinanceira/str1/ParticipantesSTR.csv"],
      "flatName": "getBankByCode",
      "params": [{ "name": "code", "type": "string | number" }],
      "returns": "Bank?",
      "tests": [
        { "args": ["001"], "returns": { "code": "001", "ispb": "00000000", "name": "Banco do Brasil S.A." } },
        { "name": "unpadded", "args": ["1"], "returns": { "code": "001", "ispb": "00000000", "name": "Banco do Brasil S.A." } },
        { "name": "number", "args": [1], "returns": { "code": "001", "ispb": "00000000", "name": "Banco do Brasil S.A." } },
        { "args": ["341"], "returns": { "code": "341", "ispb": "60701190", "name": "ITAÚ UNIBANCO S.A." } },
        { "name": "nonexistent", "args": ["999"], "returns": null },
        { "args": ["abc"], "returns": null },
        { "name": "empty", "args": [""], "returns": null }
      ]
    },
    "getByIspb": {
      "summary": "Looks up a Brazilian bank by its ISPB (Identificador do Sistema de Pagamentos Brasileiro), the 8 digit code that identifies every participant of the SPB, published by Banco Central do Brasil in the STR (Sistema de Transferência de Reservas) participants list. Every SPB participant has an ISPB, but this dataset only carries the institutions that also have a COMPE code, so an ISPB whose institution has no COMPE code of its own returns `null`.",
      "description": [
        "Looks a bank up by its 8-digit ISPB (Identificador do Sistema de Pagamentos Brasileiro).",
        "",
        "- `value` may be a string or a number, with or without leading zeros.",
        "- The dataset only has institutions that also have a COMPE code; any other ISPB returns null."
      ],
      "references": ["https://www.bcb.gov.br/content/estabilidadefinanceira/str1/ParticipantesSTR.csv"],
      "flatName": "getBankByIspb",
      "params": [{ "name": "value", "type": "string | number" }],
      "returns": "Bank?",
      "tests": [
        { "args": ["00000000"], "returns": { "code": "001", "ispb": "00000000", "name": "Banco do Brasil S.A." } },
        { "args": ["60701190"], "returns": { "code": "341", "ispb": "60701190", "name": "ITAÚ UNIBANCO S.A." } },
        { "name": "nonexistent", "args": ["99999999"], "returns": null },
        { "args": ["abc"], "returns": null },
        { "name": "empty", "args": [""], "returns": null }
      ]
    },
    "list": {
      "summary": "Returns every Brazilian bank with a compensation code (COMPE), published by Banco Central do Brasil in the STR (Sistema de Transferência de Reservas) participants list.",
      "description": [
        "Returns every bank with a COMPE code from the Banco Central do Brasil STR participants list.",
        "",
        "- Each entry carries the COMPE `code` (3 digits), the `ispb` (8 digits) and the `name`."
      ],
      "references": ["https://www.bcb.gov.br/content/estabilidadefinanceira/str1/ParticipantesSTR.csv"],
      "flatName": "getBanks",
      "params": [],
      "returns": "Bank[]"
    }
  }
}
